{
  "schemaVersion": 1,
  "name": "NGIN.ECS",
  "version": "0.1.0",
  "compatiblePlatformRange": ">=0.1.0-alpha.1 <0.2.0",
  "platforms": [
    "linux",
    "windows",
    "macos"
  ],
  "dependencies": [
    {
      "name": "NGIN.Base",
      "versionRange": ">=0.1.0 <1.0.0",
      "optional": false
    },
    {
      "name": "NGIN.Core",
      "versionRange": ">=0.1.0 <1.0.0",
      "optional": false
    }
  ],
  "bootstrap": {
    "mode": "BuilderHookV1",
    "entryPoint": "NGIN_Bootstrap_NGIN_ECS",
    "autoApply": true
  },
  "provides": {
    "modules": [
      "Domain.ECS"
    ],
    "plugins": []
  }
}
