{
  "schemaVersion": 1,
  "name": "Samples.DemoPackage",
  "version": "0.1.0",
  "compatiblePlatformRange": ">=0.1.0 <1.0.0",
  "platforms": [
    "linux",
    "windows",
    "macos"
  ],
  "dependencies": [],
  "bootstrap": {
    "mode": "BuilderHookV1",
    "entryPoint": "NGIN_Bootstrap_Samples_DemoPackage",
    "autoApply": true
  },
  "provides": {
    "modules": [
      "App.PackageBootstrap"
    ],
    "plugins": []
  }
}
