{
  "schemaVersion": 1,
  "name": "NGIN.ECS",
  "version": "0.1.0",
  "compatiblePlatformRange": ">=0.1.0-alpha.1 <0.2.0",
  "platforms": [
    "linux",
    "windows",
    "macos"
  ],
  "dependencies": [
    {
      "name": "NGIN.Base",
      "versionRange": ">=0.1.0 <0.2.0",
      "optional": false
    },
    {
      "name": "NGIN.Core",
      "versionRange": ">=0.1.0 <0.2.0",
      "optional": false
    },
    {
      "name": "NGIN.Reflection",
      "versionRange": ">=0.1.0 <0.2.0",
      "optional": true
    }
  ],
  "provides": {
    "modules": [
      "Domain.ECS"
    ],
    "plugins": []
  }
}
